id,comment_id,channel_id,video_id,video_title,video_tags,author_name,comment_text,published_at,updated_at,like_count,parent_comment_id,_low_info
21511261,UgwNceT6ICOjFdb-DoJ4AaABAg,UCu1FzjrHosuKGvgIx8oBi8w,_UIM7_CNPPo,[짤] 권영진 화이자 사기극에 당했다?,"새날,새가날아든다",@douchoi223,"대구 권씨, 서울 오씨, 부산 박씨~ 이런 인간들도 단체장을 할수 있는, 민주주의 국가ㅠ.. 그래도 이런것들은 아닌듯합니다..",2021-06-05 07:12:51,2021-06-05 07:12:51,12,,False
21511260,UgzU6f6LTo_N0dGLywd4AaABAg,UCu1FzjrHosuKGvgIx8oBi8w,_UIM7_CNPPo,[짤] 권영진 화이자 사기극에 당했다?,"새날,새가날아든다",@석정-b5z,사기당했으면 바보같은 인간들 구속해야지,2021-06-05 07:15:46,2021-06-05 07:15:46,9,,False
21511259,UgwZo4WoelMG5wxS-fF4AaABAg,UCu1FzjrHosuKGvgIx8oBi8w,_UIM7_CNPPo,[짤] 권영진 화이자 사기극에 당했다?,"새날,새가날아든다",@팍코코-r7z,권영진 공수처에서 수사 좀,2021-06-05 07:21:40,2021-06-05 07:21:40,3,,False
21511258,UgzZZsmIrPESJblbzOZ4AaABAg,UCu1FzjrHosuKGvgIx8oBi8w,_UIM7_CNPPo,[짤] 권영진 화이자 사기극에 당했다?,"새날,새가날아든다",@석정-b5z,짝퉁 백신이 은밀하게 들여왔다면 정말 상상하기 싫은일이 일어날수도 있었겠다,2021-06-05 07:25:50,2021-06-05 07:27:08,1,,False
21511257,Ugz1Grn0RyPyAQrR3I14AaABAg,UCu1FzjrHosuKGvgIx8oBi8w,_UIM7_CNPPo,[짤] 권영진 화이자 사기극에 당했다?,"새날,새가날아든다",@guemheejeong9996,권영진이 헛발질로 대구시 예산 20억원 날렸네요.,2021-06-05 07:37:05,2021-06-05 07:46:10,11,,False
21511256,UgxEkIgGojz5Psi1ZVd4AaABAg,UCu1FzjrHosuKGvgIx8oBi8w,_UIM7_CNPPo,[짤] 권영진 화이자 사기극에 당했다?,"새날,새가날아든다",@YS-yy6sx,대구시민 시의원 은 20억 세금 낭비 했는지 확인하고 방송 해라 민주당 국회의원도 이런사기에 일해라,2021-06-05 07:38:37,2021-06-05 07:38:37,4,,False
21511376,Ugx-8T-2q3AAVSaKnW54AaABAg.9OBivHZqtUi9OCGJNNQLbz,UCu1FzjrHosuKGvgIx8oBi8w,_UIM7_CNPPo,[짤] 권영진 화이자 사기극에 당했다?,"새날,새가날아든다",@guemheejeong9996,"개, 돼지 취급당하는 줄 모르는 것같아요",2021-06-05 07:44:45,2021-06-05 07:44:45,2,Ugx-8T-2q3AAVSaKnW54AaABAg,False
21511255,UgwpdH7UWGrw6JvC-4V4AaABAg,UCu1FzjrHosuKGvgIx8oBi8w,_UIM7_CNPPo,[짤] 권영진 화이자 사기극에 당했다?,"새날,새가날아든다",@sss-br6gr,대구시장이 보이시피싱을 당해 ? 20억 물어내고 감방 가야지 ᆢ,2021-06-05 07:50:18,2021-06-05 07:50:18,21,,False
21511252,UgwBfH7HKiNGsjy0Ngd4AaABAg,UCu1FzjrHosuKGvgIx8oBi8w,_UIM7_CNPPo,[짤] 권영진 화이자 사기극에 당했다?,"새날,새가날아든다",@동트는아침-s8q,백신 사는데 혈세를 사기당했다면 대구시장 네사비로 물어내라 똑똑히 지켜볼것이다,2021-06-05 08:03:17,2021-06-05 08:03:17,8,,False
21511251,UgzXN496O7lBaL68B5R4AaABAg,UCu1FzjrHosuKGvgIx8oBi8w,_UIM7_CNPPo,[짤] 권영진 화이자 사기극에 당했다?,"새날,새가날아든다",@매봉산-v6x,황교안하고 권영진하고 연간이 있나 공수처 경찰에서 조사을 해야한다,2021-06-05 08:45:43,2021-06-11 10:06:38,30,,False
21511249,Ugyl14ZuhUn5Z9Kszr94AaABAg,UCu1FzjrHosuKGvgIx8oBi8w,_UIM7_CNPPo,[짤] 권영진 화이자 사기극에 당했다?,"새날,새가날아든다",@짬실짜장,그래도 대구시민은 권영진이 뽑습니다. 아무리 얘기해봐도 소용없어요,2021-06-05 08:56:59,2021-06-05 08:56:59,8,,False
21511248,UgxkwajoeDeEn_e87hp4AaABAg,UCu1FzjrHosuKGvgIx8oBi8w,_UIM7_CNPPo,[짤] 권영진 화이자 사기극에 당했다?,"새날,새가날아든다",@짬실짜장,정진석 사돈 덕흠이도 수사해야,2021-06-05 08:57:26,2021-06-05 08:58:38,1,,False
21511246,UgyIzJ29HTchTJnqZEF4AaABAg,UCu1FzjrHosuKGvgIx8oBi8w,_UIM7_CNPPo,[짤] 권영진 화이자 사기극에 당했다?,"새날,새가날아든다",@짬실짜장,홍혜걸티비 지나다 밨는데 아유진짜 세상에서 지가 제일 잘났어. 누굴 가르치려 드는지 ㅠ az 가지고 용을 쓰드만,2021-06-05 08:59:41,2021-06-05 09:00:30,12,,False
21511244,Ugyy2PYozAJYbcx-y-F4AaABAg,UCu1FzjrHosuKGvgIx8oBi8w,_UIM7_CNPPo,[짤] 권영진 화이자 사기극에 당했다?,"새날,새가날아든다",@lakeyun21,이래도 대구시민은 저놈 찍어준다 그러니 계속저런짓 한다에 500원건다,2021-06-05 09:22:19,2021-06-05 09:22:19,23,,False
21511243,UgxaIG37NwxeTfP-N614AaABAg,UCu1FzjrHosuKGvgIx8oBi8w,_UIM7_CNPPo,[짤] 권영진 화이자 사기극에 당했다?,"새날,새가날아든다",@ceciliaholm1840,이사람은 정말 자질이 의심스러워요. 하는일마다 시장자격미달입니다. 어찌 국록을 먹는 사람이 상식도 없고 능력도 수준이 이런가요? 대한민국에 먹칠하고있어요. 엄연한 업무 과오니 사직하는것이 나라에 도움이 되겠네요. 어느 선진국 장관은 토블레로네 초콜렛을 실수로 업무용 카드로 구매했다 정치인생 끝났습니다.,2021-06-05 09:43:20,2021-06-05 09:43:20,5,,False
21511242,UgzwnXf7-1QbN1Wsa8J4AaABAg,UCu1FzjrHosuKGvgIx8oBi8w,_UIM7_CNPPo,[짤] 권영진 화이자 사기극에 당했다?,"새날,새가날아든다",@봄날-n8f,의시가 없는 나라에 주는게 아니라 의사가 없는 도서 지역에 보낸다 했는데요 도서지역은 여러번 들어가기 힘드니까 한번으로 접종할 계획이라고 해군 함정 이용해서 주민들 접종 한뎄는데....,2021-06-05 09:56:20,2021-06-09 05:13:48,0,,False
21511241,UgygI8ZB-0zGvQwjYWZ4AaABAg,UCu1FzjrHosuKGvgIx8oBi8w,_UIM7_CNPPo,[짤] 권영진 화이자 사기극에 당했다?,"새날,새가날아든다",@배길수-e2r,우한에서 폐렴이 성행하니.우한에서 대구신천지 패거리들이 대구로 무더기로 기어들으왔다.이게 코로나 원흉이다. 돌아다니면서 하지말라면.더 개거품물고 돌아다녔다. 대구시장놈은 그당시 뭐했나? 그입에서 그런말이 나오나? 대구망신 나라망신 고마시키라.,2021-06-05 09:59:57,2021-06-05 10:07:59,0,,False
21511240,UgwJ-MZgYWYQTn2-AdZ4AaABAg,UCu1FzjrHosuKGvgIx8oBi8w,_UIM7_CNPPo,[짤] 권영진 화이자 사기극에 당했다?,"새날,새가날아든다",@가로세로-r2o,치욕을 넘어 대한민국을 모독했음 어쩔건가 바로 국속수사 해서 뻔뻔한 가면을 벋겨라,2021-06-05 10:06:56,2021-06-05 10:06:56,1,,False
21511239,Ugx5nMkn6ocHpPyruJF4AaABAg,UCu1FzjrHosuKGvgIx8oBi8w,_UIM7_CNPPo,[짤] 권영진 화이자 사기극에 당했다?,"새날,새가날아든다",@쟈이몽리,새날 진행자분들 빠트린것있내요 윤씨가 대구출장간건 백신구했다고 불러들인거임 한껀했으니 나땜에 정권잡으연 총리달라고 수작부린거임,2021-06-05 10:16:00,2021-06-05 10:16:00,1,,False
21511238,UgylwK599FtzBzOG9r54AaABAg,UCu1FzjrHosuKGvgIx8oBi8w,_UIM7_CNPPo,[짤] 권영진 화이자 사기극에 당했다?,"새날,새가날아든다",@은하수-g1i,대구시장권영진좆됏네.고소해라.,2021-06-05 10:19:20,2021-06-05 10:19:20,0,,False
21511237,UgwT8ZWCFa8yZkeo8WV4AaABAg,UCu1FzjrHosuKGvgIx8oBi8w,_UIM7_CNPPo,[짤] 권영진 화이자 사기극에 당했다?,"새날,새가날아든다",@벼리야-y3b,백성의 고혈이 저런것들에게 꼬박꼬박 급여로 나가다니. 세금 내야 되는데 절라 내기싫다,2021-06-05 10:30:37,2021-06-05 10:30:37,3,,False
21511236,UgyAhDeoiB3C7QvjhB94AaABAg,UCu1FzjrHosuKGvgIx8oBi8w,_UIM7_CNPPo,[짤] 권영진 화이자 사기극에 당했다?,"새날,새가날아든다",@김태완-u1l,스트레스가 풀리네요... 오늘방송은..,2021-06-05 10:51:53,2021-06-05 10:51:53,1,,False
21511235,UgztZI0Q89w5k2OhFhx4AaABAg,UCu1FzjrHosuKGvgIx8oBi8w,_UIM7_CNPPo,[짤] 권영진 화이자 사기극에 당했다?,"새날,새가날아든다",@김태운-y6q,참나 대구시민 불쌍하다 아 창피하다,2021-06-05 11:25:05,2021-06-05 11:26:43,2,,False
21511234,UgwvI7qCvHPjOzzllgB4AaABAg,UCu1FzjrHosuKGvgIx8oBi8w,_UIM7_CNPPo,[짤] 권영진 화이자 사기극에 당했다?,"새날,새가날아든다",@김성식-t3v6p,맹물백신 맞고 항체생기면 어떡헐래?어!,2021-06-05 11:39:32,2021-06-05 11:39:32,0,,False
21511233,UgyT21975fubI5quHHx4AaABAg,UCu1FzjrHosuKGvgIx8oBi8w,_UIM7_CNPPo,[짤] 권영진 화이자 사기극에 당했다?,"새날,새가날아든다",@석각원,사고만 치는 권씨 대책없는 놈 이 시키 어째야쓰까요.,2021-06-05 11:59:19,2021-06-05 11:59:19,1,,False
21511396,UgyM8kOZJxpO3DizDu14AaABAg.9OBgRyZe3gk9OCk-U2kq1d,UCu1FzjrHosuKGvgIx8oBi8w,_UIM7_CNPPo,[짤] 권영진 화이자 사기극에 당했다?,"새날,새가날아든다",@sueoh8433,"토착대구현 입니다, TK현. 수구골통들 못난이,살인마 대통들 생산지....",2021-06-05 12:12:55,2021-06-05 12:12:55,6,UgyM8kOZJxpO3DizDu14AaABAg,False
21511397,UgyM8kOZJxpO3DizDu14AaABAg.9OBgRyZe3gk9OCkIWs8igF,UCu1FzjrHosuKGvgIx8oBi8w,_UIM7_CNPPo,[짤] 권영진 화이자 사기극에 당했다?,"새날,새가날아든다",@김양수-s1p,토착대구현 정말 멋진 표현이십니다 저도 써먹고 싶습니다 토착대구현 입에 촥촥 감깁니다 ㅎㅎㅎ,2021-06-05 12:15:31,2021-06-05 12:15:31,5,UgyM8kOZJxpO3DizDu14AaABAg,False
21511404,Ugwtaup2fI82a7Y1NDF4AaABAg.9OBfTlCOX-U9OCkdb4p98B,UCu1FzjrHosuKGvgIx8oBi8w,_UIM7_CNPPo,[짤] 권영진 화이자 사기극에 당했다?,"새날,새가날아든다",@방철호-q3c,백날애기해봐라 대구인간들바뀌나! 차라리 개가 두발로걷는게더빠를걸~~ 장담한다,2021-06-05 12:18:32,2021-06-05 12:18:32,11,Ugwtaup2fI82a7Y1NDF4AaABAg,False
21511363,UgyfIBsQKT9K8soyCzZ4AaABAg.9OBkJtFRsLp9OCkrWSjnE1,UCu1FzjrHosuKGvgIx8oBi8w,_UIM7_CNPPo,[짤] 권영진 화이자 사기극에 당했다?,"새날,새가날아든다",@sueoh8433,극우!¡!니까!.. 징그러워요.,2021-06-05 12:20:26,2021-06-05 12:20:26,4,UgyfIBsQKT9K8soyCzZ4AaABAg,False
21511312,UgxwrJttlrGjyZ43QfB4AaABAg.9OBrxRcdeTE9OClWtalXNF,UCu1FzjrHosuKGvgIx8oBi8w,_UIM7_CNPPo,[짤] 권영진 화이자 사기극에 당했다?,"새날,새가날아든다",@sueoh8433,"유유상종들, 자업자득!¡! 꼬시다!.. 대구현, 토착 왜구들!",2021-06-05 12:26:13,2021-06-05 12:26:13,1,UgxwrJttlrGjyZ43QfB4AaABAg,False
21511306,UgyBMm8LgwNVarR3J3B4AaABAg.9OBu2Q0CaAg9OCmk7DKqom,UCu1FzjrHosuKGvgIx8oBi8w,_UIM7_CNPPo,[짤] 권영진 화이자 사기극에 당했다?,"새날,새가날아든다",@sueoh8433,"대구는 가볼것도, 뭐도 아무것도 없는 데프리카...",2021-06-05 12:36:54,2021-06-05 12:36:54,1,UgyBMm8LgwNVarR3J3B4AaABAg,False
21511232,Ugw22qWp6WCtQiVlirl4AaABAg,UCu1FzjrHosuKGvgIx8oBi8w,_UIM7_CNPPo,[짤] 권영진 화이자 사기극에 당했다?,"새날,새가날아든다",@tigerryu8764,뵹신중에 상뵹신 대구쓰레기 시장 ㅡ 고객님 당황하셨어요~ㅋ ㅋ,2021-06-05 12:42:02,2021-06-05 13:08:55,1,,False
21511402,UgzjmxvkoVpQszH4GTl4AaABAg.9OBgKaPseyn9OCnXgo2M7e,UCu1FzjrHosuKGvgIx8oBi8w,_UIM7_CNPPo,[짤] 권영진 화이자 사기극에 당했다?,"새날,새가날아든다",@tigerryu8764,ㅋㅋ 머라 변명도 못하겠네ㅡ,2021-06-05 12:43:48,2021-06-05 12:43:48,6,UgzjmxvkoVpQszH4GTl4AaABAg,False
21511428,UgzrTKvSQlBNA8b1UOR4AaABAg.9OBacLiWRQV9OCo8Yspb3t,UCu1FzjrHosuKGvgIx8oBi8w,_UIM7_CNPPo,[짤] 권영진 화이자 사기극에 당했다?,"새날,새가날아든다",@tigerryu8764,집이아닌 쓰레기장으로ㅡ,2021-06-05 12:49:06,2021-06-05 12:49:06,1,UgzrTKvSQlBNA8b1UOR4AaABAg,False
21511283,UgwGKo7X-kBIwNHttaB4AaABAg.9OC1dAmq1DJ9OCoKi2--gH,UCu1FzjrHosuKGvgIx8oBi8w,_UIM7_CNPPo,[짤] 권영진 화이자 사기극에 당했다?,"새날,새가날아든다",@tigerryu8764,찍어준 답례 ㅡ,2021-06-05 12:50:46,2021-06-05 12:50:46,2,UgwGKo7X-kBIwNHttaB4AaABAg,False
21511262,UgwNceT6ICOjFdb-DoJ4AaABAg.9OCCejdmAkC9OCpdUHuDCO,UCu1FzjrHosuKGvgIx8oBi8w,_UIM7_CNPPo,[짤] 권영진 화이자 사기극에 당했다?,"새날,새가날아든다",@tigerryu8764,갱상 국짐이닌까 가능하지요~ 다음선거때도 변한없이 대구이니까ㅡ,2021-06-05 13:02:12,2021-06-05 13:02:12,1,UgwNceT6ICOjFdb-DoJ4AaABAg,False
21511384,UgzdksNVqqv2les1c2V4AaABAg.9OBhq9WcxCc9OCpsgnYIsU,UCu1FzjrHosuKGvgIx8oBi8w,_UIM7_CNPPo,[짤] 권영진 화이자 사기극에 당했다?,"새날,새가날아든다",@tigerryu8764,갱상도닌까 가능한일아닐까요~,2021-06-05 13:04:17,2021-06-05 13:04:17,2,UgzdksNVqqv2les1c2V4AaABAg,False
21511231,Ugzmw4QgFaQqOPTSjxl4AaABAg,UCu1FzjrHosuKGvgIx8oBi8w,_UIM7_CNPPo,[짤] 권영진 화이자 사기극에 당했다?,"새날,새가날아든다",@노노노-o5x,니? 많이 당했니?,2021-06-05 13:22:32,2021-06-05 13:22:32,1,,False
21511323,UgyNvLtwk-VGhCWC56V4AaABAg.9OBpPzM_mgo9OCsGVYBGFH,UCu1FzjrHosuKGvgIx8oBi8w,_UIM7_CNPPo,[짤] 권영진 화이자 사기극에 당했다?,"새날,새가날아든다",@김현중-y2b,대구 맞어~~,2021-06-05 13:25:09,2021-06-05 13:25:09,0,UgyNvLtwk-VGhCWC56V4AaABAg,False
21511324,UgyNvLtwk-VGhCWC56V4AaABAg.9OBpPzM_mgo9OCsMBPWKZ2,UCu1FzjrHosuKGvgIx8oBi8w,_UIM7_CNPPo,[짤] 권영진 화이자 사기극에 당했다?,"새날,새가날아든다",@김현중-y2b,왜 수사해!,2021-06-05 13:25:55,2021-06-05 13:25:55,0,UgyNvLtwk-VGhCWC56V4AaABAg,False
21511230,UgyF22YM9wxfDmEYfnV4AaABAg,UCu1FzjrHosuKGvgIx8oBi8w,_UIM7_CNPPo,[짤] 권영진 화이자 사기극에 당했다?,"새날,새가날아든다",@김현중-y2b,왜 권영진을 욕해~~~,2021-06-05 13:33:48,2021-06-05 13:33:48,0,,False
21511229,Ugyq9L9Uab6OqvQ30s94AaABAg,UCu1FzjrHosuKGvgIx8oBi8w,_UIM7_CNPPo,[짤] 권영진 화이자 사기극에 당했다?,"새날,새가날아든다",@kydkim5971,"아이고 저개,,,어쩌나 저런 모지리를 시장이랍시고 뽑아놓고 권리행사 했다고 허허 참 웃어야 할찌 울어야 할찌 햇깔리고마",2021-06-05 13:51:10,2021-06-05 13:51:10,0,,False
21511371,Ugz7hMZJ2ZJloFGoEGt4AaABAg.9OBj4isZYUq9OD-4W8Nzq3,UCu1FzjrHosuKGvgIx8oBi8w,_UIM7_CNPPo,[짤] 권영진 화이자 사기극에 당했다?,"새날,새가날아든다",@행복한세상을선한영향,뭔가 꿍꿍이가 있을듯ᆢ사실은 똑똑한 사람 아닐까여? 모지리 처럼 보이려고 쑈하는 건 아닐까요?,2021-06-05 14:33:25,2021-06-05 14:33:25,0,Ugz7hMZJ2ZJloFGoEGt4AaABAg,False
21511372,Ugz7hMZJ2ZJloFGoEGt4AaABAg.9OBj4isZYUq9OD0DoC1awU,UCu1FzjrHosuKGvgIx8oBi8w,_UIM7_CNPPo,[짤] 권영진 화이자 사기극에 당했다?,"새날,새가날아든다",@강영아씨,에이 그정도면 국제적 망신 당할일 안만들고 빠져나갔죠,2021-06-05 14:43:25,2021-06-05 14:43:25,0,Ugz7hMZJ2ZJloFGoEGt4AaABAg,False
21511228,Ugx4CusawGcxw2vt0e14AaABAg,UCu1FzjrHosuKGvgIx8oBi8w,_UIM7_CNPPo,[짤] 권영진 화이자 사기극에 당했다?,"새날,새가날아든다",@kang5349,2호 머저리가 대구에서 나왔네요 1호 머저리는 서울서 윤십열로 저렇게 한심한 인간이 시장이라니,2021-06-05 14:43:27,2021-06-05 14:43:27,0,,False
21511227,UgziM_heRP1t5wjCsr94AaABAg,UCu1FzjrHosuKGvgIx8oBi8w,_UIM7_CNPPo,[짤] 권영진 화이자 사기극에 당했다?,"새날,새가날아든다",@행복한세상을선한영향,구독자 100명 추가요? 축하드립니다. 👏👏👏👏👏👏👏🎂💐🙆‍♀️,2021-06-05 14:54:06,2021-06-05 14:54:20,1,,False
21511226,UgwZ9kdIdHuH3-_9xnF4AaABAg,UCu1FzjrHosuKGvgIx8oBi8w,_UIM7_CNPPo,[짤] 권영진 화이자 사기극에 당했다?,"새날,새가날아든다",@손미애-o8d,해외언론인은대구가 대한민국땅인줄 안다ㅋ,2021-06-05 15:01:52,2021-06-05 15:01:52,3,,False
21511225,UgyKrV6mt-kCDGSLDMJ4AaABAg,UCu1FzjrHosuKGvgIx8oBi8w,_UIM7_CNPPo,[짤] 권영진 화이자 사기극에 당했다?,"새날,새가날아든다",@빅마마-y2r,근데..왜 수사를 안하는지 모르겠네요..나라돈 갖고 대체 피싱이나 당하고..권영진 걍..일본으로 가라..개대구만든 1등공신,2021-06-05 15:37:13,2021-06-05 15:37:13,1,,False
21511224,UgyWZPbpGheni9oQHRx4AaABAg,UCu1FzjrHosuKGvgIx8oBi8w,_UIM7_CNPPo,[짤] 권영진 화이자 사기극에 당했다?,"새날,새가날아든다",@kkumbyeol,나라에 도움은커녕 어떻게 하면 망치려고 작정하는 무리들,2021-06-05 15:54:10,2021-06-05 15:54:10,4,,False
21511223,UgzXLDkUlI6DfJUJR_d4AaABAg,UCu1FzjrHosuKGvgIx8oBi8w,_UIM7_CNPPo,[짤] 권영진 화이자 사기극에 당했다?,"새날,새가날아든다",@박소화-l8h,가지 가지 하네요 대구가 고향인 사람도 챙피 해서 얼굴 들고 다니기 부끄럽습니다,2021-06-05 16:08:41,2021-06-05 16:08:41,0,,False
21511222,Ugw5aAdVBaTMs94DsKF4AaABAg,UCu1FzjrHosuKGvgIx8oBi8w,_UIM7_CNPPo,[짤] 권영진 화이자 사기극에 당했다?,"새날,새가날아든다",@bruce235-r8v,권영진이 또나와두 찍어주는 뇌가 없는 시민 들이지요,2021-06-05 17:36:44,2021-06-05 17:36:44,1,,False
21511221,UgwJc-hbzFAzI1MQUdh4AaABAg,UCu1FzjrHosuKGvgIx8oBi8w,_UIM7_CNPPo,[짤] 권영진 화이자 사기극에 당했다?,"새날,새가날아든다",@국제신사-x6t,대구시민들이 얼마나 속상할까? ㅉㅉ,2021-06-05 17:37:20,2021-06-05 17:37:20,2,,False
21511220,UgyZrNKLawQBT-wXb3p4AaABAg,UCu1FzjrHosuKGvgIx8oBi8w,_UIM7_CNPPo,[짤] 권영진 화이자 사기극에 당했다?,"새날,새가날아든다",@ljy3250,담시장 권씨일거임. 저긴 절대 안 바뀜.,2021-06-05 17:51:40,2021-06-05 17:51:40,0,,False
21511219,UgwNG2fnqYq6aQjRALN4AaABAg,UCu1FzjrHosuKGvgIx8oBi8w,_UIM7_CNPPo,[짤] 권영진 화이자 사기극에 당했다?,"새날,새가날아든다",@Atomy815,권양진에 사기 헐리우드 액션 취할때부터 이놈의 진면모를 보았다. 시장은 무슨? 천하에 사기꾼넘이지.,2021-06-05 18:59:55,2021-06-05 18:59:55,3,,False
21511218,UgwQdAP2KS3NQ-fThkl4AaABAg,UCu1FzjrHosuKGvgIx8oBi8w,_UIM7_CNPPo,[짤] 권영진 화이자 사기극에 당했다?,"새날,새가날아든다",@이채은-m3o,대구는 우리 옆동네 일본인의 습성과 거의 비슷함. 대한민국정부가 하는 모든 일에 반대하고 디지털화되고 선진화된 한국의 시스템을 무시하면서 따라가지 못 하는 대구의 분위기 대구는 한국에서 경제성장률이 가장 떨어지고 활력이 없는 도시다. 정말 진지하게 대구와 경북이 분리해서 독립하는 길을 찾아보는게 어떨지..,2021-06-05 19:38:34,2021-06-05 19:38:34,0,,False
21511344,UgyJXCNYnPz7tKKRkTZ4AaABAg.9OBn1-RKc1H9ODeV32rhyh,UCu1FzjrHosuKGvgIx8oBi8w,_UIM7_CNPPo,[짤] 권영진 화이자 사기극에 당했다?,"새날,새가날아든다",@parkhyosung,아직 분위기 파악 못하네. 권영진이가세계적인 바보가 되었는데..머리가 모자라면 가만히 있는게 도와주는거다.,2021-06-05 20:44:02,2021-06-05 20:44:02,1,UgyJXCNYnPz7tKKRkTZ4AaABAg,False
21511217,Ugx-rzDQQukk33JZZoB4AaABAg,UCu1FzjrHosuKGvgIx8oBi8w,_UIM7_CNPPo,[짤] 권영진 화이자 사기극에 당했다?,"새날,새가날아든다",@wusongyang7751,국민은 정치인이 싸질러 놓는 똥을 치우기 위해 존재하지 않읍니다.....,2021-06-05 21:01:02,2021-06-05 21:01:02,0,,False
21511216,Ugw1Es9vPuP4yNcjEP94AaABAg,UCu1FzjrHosuKGvgIx8oBi8w,_UIM7_CNPPo,[짤] 권영진 화이자 사기극에 당했다?,"새날,새가날아든다",@sym7563,진짜 진짜 추미애 조국같은 전사가 10명만있었다면 우리사회가 윤깡패같은인간이 나왔을까용잉,2021-06-05 21:45:12,2021-06-05 21:45:12,0,,False
21511215,UgxZ__e-bcL9nw_y3HF4AaABAg,UCu1FzjrHosuKGvgIx8oBi8w,_UIM7_CNPPo,[짤] 권영진 화이자 사기극에 당했다?,"새날,새가날아든다",@김현철-v8g,정은경 창장 인증합니다,2021-06-05 22:14:37,2021-06-05 22:14:37,1,,False
21511214,Ugy3LME0iQygHY3O5jB4AaABAg,UCu1FzjrHosuKGvgIx8oBi8w,_UIM7_CNPPo,[짤] 권영진 화이자 사기극에 당했다?,"새날,새가날아든다",@편집귀찮음,"미국 가서 쪽팔리게 한 황씨하고, 권씨는 모임 하나 해라.....대한민국의 쪽팔림 일인자가 누구인지 둘이 토론해서 발표해라...",2021-06-05 22:57:08,2021-06-05 22:57:08,5,,False
21511213,Ugz03q8uGsYSHE0w06d4AaABAg,UCu1FzjrHosuKGvgIx8oBi8w,_UIM7_CNPPo,[짤] 권영진 화이자 사기극에 당했다?,"새날,새가날아든다",@장근우-z7h,처음방송에 내보낼때 국민의힘 소속 권영진대구시장이라고 맨트를 날려주셨으면 합니다.,2021-06-05 23:11:55,2021-06-05 23:11:55,0,,False
21511212,UgxXtWn4NMQk5gN-Hwt4AaABAg,UCu1FzjrHosuKGvgIx8oBi8w,_UIM7_CNPPo,[짤] 권영진 화이자 사기극에 당했다?,"새날,새가날아든다",@ekkim3862,저런걸 사장으로 뽑은 …아이구 긴급자금은 꿀꺽하고 아ㄴ 내놓고 도둑놈이냐 시장이냐,2021-06-05 23:21:10,2021-06-05 23:21:10,0,,False
21511247,UgyIzJ29HTchTJnqZEF4AaABAg.9OCOtCthnZv9ODy0acCMm9,UCu1FzjrHosuKGvgIx8oBi8w,_UIM7_CNPPo,[짤] 권영진 화이자 사기극에 당했다?,"새날,새가날아든다",@누구셔요-c2g,마누라와 보수방송나가더니 많이변했어 그전에는 인간성이좋아 팬이었는데 지금은 AZ백신까는유투버 인간성보임,2021-06-05 23:34:38,2021-06-05 23:34:38,0,UgyIzJ29HTchTJnqZEF4AaABAg,False
21511211,UgyjtK5CX3wjpGJLZhh4AaABAg,UCu1FzjrHosuKGvgIx8oBi8w,_UIM7_CNPPo,[짤] 권영진 화이자 사기극에 당했다?,"새날,새가날아든다",@박인환-h4r,권영진 구상권 신청,2021-06-05 23:46:31,2021-06-05 23:46:31,0,,False
21511208,UgzQmpsoZORYQTveGQl4AaABAg,UCu1FzjrHosuKGvgIx8oBi8w,_UIM7_CNPPo,[짤] 권영진 화이자 사기극에 당했다?,"새날,새가날아든다",@platinumclass,"권징징이는 지가 능력이 있다고 믿으면, 자신있으면 화이자 대표이사한테 직접연락을 해보던지 하지 빙신처럼 사기나 당하고 ㅉㅉ 돈을 줬던 안줬던 대구시민, 전국민을 호도 한죄를 물어여한다.",2021-06-06 00:15:43,2021-06-06 00:18:40,0,,False
21511207,Ugx51H-7UipSOgrkfFh4AaABAg,UCu1FzjrHosuKGvgIx8oBi8w,_UIM7_CNPPo,[짤] 권영진 화이자 사기극에 당했다?,"새날,새가날아든다",@최병순-b6d,기레기 언론들은 왜 조용하지 민주진영이 하면 대서 특필 할뗀데~~ 쯔쯔~~,2021-06-06 00:16:08,2021-06-06 00:16:08,5,,False
21511206,Ugz_69ZbGIssTxqJdP14AaABAg,UCu1FzjrHosuKGvgIx8oBi8w,_UIM7_CNPPo,[짤] 권영진 화이자 사기극에 당했다?,"새날,새가날아든다",@늘푸른-u9u,검찰은 권영진 매국노 즉각 체포하여 압수수색해야 한다....국민ㄷ.ㄹ은 진실을 알고싶다....국가망신 시키고 혈세 20억 날려버린 권영진은 중대 범죄자다,2021-06-06 00:16:46,2021-06-06 00:16:46,0,,False
21511205,Ugxo-uA56qbb1nmvzFh4AaABAg,UCu1FzjrHosuKGvgIx8oBi8w,_UIM7_CNPPo,[짤] 권영진 화이자 사기극에 당했다?,"새날,새가날아든다",@최병순-b6d,호남은 노인들이 많다 대구는 공장이 많아서 젊은 사람이 많아 호남은 어렵다 너희들이 잘살아 기레기 언론 정신차리고 기사써라~~ 3살먹은 애기도 안다 그렇게 어리석지 않아~~ 기레기들아,2021-06-06 00:20:40,2021-06-06 00:20:40,0,,False
21511204,UgylSzB3ORRaDtyYGGh4AaABAg,UCu1FzjrHosuKGvgIx8oBi8w,_UIM7_CNPPo,[짤] 권영진 화이자 사기극에 당했다?,"새날,새가날아든다",@lsj6434,장풍으로도 쓰러지는 징징아 너는 이세상욕도아깝다 박정희가부른다 수의입고 잘가라,2021-06-06 00:31:47,2021-06-06 00:31:47,0,,False
21511203,UgzWbvDvlXLEk1hkM_R4AaABAg,UCu1FzjrHosuKGvgIx8oBi8w,_UIM7_CNPPo,[짤] 권영진 화이자 사기극에 당했다?,"새날,새가날아든다",@멀위랑다래랑,대구사람들은 절대 손잡아주면 안된다,2021-06-06 00:40:14,2021-06-06 00:40:14,0,,False
21511202,Ugy09uBSaoLP2oDh19p4AaABAg,UCu1FzjrHosuKGvgIx8oBi8w,_UIM7_CNPPo,[짤] 권영진 화이자 사기극에 당했다?,"새날,새가날아든다",@라일락라일락-z6e,대구 젊은이들도 속터지겠죠 친정엄마가 대구사람인데 마이동풍입니다.,2021-06-06 01:03:45,2021-06-06 01:03:45,0,,False
21511201,UgwsguG6NpAuxHc-T314AaABAg,UCu1FzjrHosuKGvgIx8oBi8w,_UIM7_CNPPo,[짤] 권영진 화이자 사기극에 당했다?,"새날,새가날아든다",@brad-tb7mw,대구랑 일본이랑 협력사인가?,2021-06-06 01:04:37,2021-06-06 01:04:48,0,,False
21511200,Ugzf3vx3LpbR1I5r13p4AaABAg,UCu1FzjrHosuKGvgIx8oBi8w,_UIM7_CNPPo,[짤] 권영진 화이자 사기극에 당했다?,"새날,새가날아든다",@노스탈쟈-u2f,불리하고 곤란하면 까무라치거나 졸도를 연기하고 징징대는 재수없는인간 이런 지질이를 시장이라고 뽑은인간들,2021-06-06 01:13:11,2021-06-06 01:13:11,17,,False
21511199,Ugwcz-mieGKaL8pjwBh4AaABAg,UCu1FzjrHosuKGvgIx8oBi8w,_UIM7_CNPPo,[짤] 권영진 화이자 사기극에 당했다?,"새날,새가날아든다",@brad-tb7mw,아마존에 얼마인가요? ㅋㅋ 대구랑 알리바바라 아마존이랑 손 잡는가요?,2021-06-06 01:20:12,2021-06-06 01:20:12,0,,False
21511198,Ugy5Zxg69oKUhvlMdVJ4AaABAg,UCu1FzjrHosuKGvgIx8oBi8w,_UIM7_CNPPo,[짤] 권영진 화이자 사기극에 당했다?,"새날,새가날아든다",@mimiseo5516,대구 미성복어도 맛있고 막창도 맛있는데 영진아 왜그랬어....?,2021-06-06 01:21:04,2021-06-06 01:21:04,2,,False
21511197,Ugyd9yqtc0X5LHvWqHZ4AaABAg,UCu1FzjrHosuKGvgIx8oBi8w,_UIM7_CNPPo,[짤] 권영진 화이자 사기극에 당했다?,"새날,새가날아든다",@김상현-w9s,아아.. 대구가 왜저런 빙신들이 설치는 데가됐노...투표좀 잘하자,2021-06-06 01:24:16,2021-06-06 01:24:16,0,,False
21511196,Ugz504iq3kE0Whld8Od4AaABAg,UCu1FzjrHosuKGvgIx8oBi8w,_UIM7_CNPPo,[짤] 권영진 화이자 사기극에 당했다?,"새날,새가날아든다",@brad-tb7mw,저 대구 시장 얘기듣고 이불속으로 들어 갔어요 너무 부끄러워서요,2021-06-06 01:26:04,2021-06-06 01:26:04,0,,False
